{
  "version": 1,
  "product": "D4 Pocket",
  "app_id": "d4-pocket-app-11111111111111111111111111111111",
  "audit_store_id": "audit-store-22222222222222222222222222222222",
  "product_version": "1.2.3+17",
  "package_sha256": "aaaaaaaaaaaaaaaaaaaaaaaaaaaaaaaaaaaaaaaaaaaaaaaaaaaaaaaaaaaaaaaa",
  "launcher_sha256": "bbbbbbbbbbbbbbbbbbbbbbbbbbbbbbbbbbbbbbbbbbbbbbbbbbbbbbbbbbbbbbbb",
  "product_manifest_sha256": "cccccccccccccccccccccccccccccccccccccccccccccccccccccccccccccccc"
}
